"Project","ScanDate","DependencyName","DependencyPath","Description","License","Md5","Sha1","Identifiers","CPE","CVE","CWE","Vulnerability","Source","CVSSv2_Severity","CVSSv2_Score","CVSSv2","CVSSv3_BaseSeverity","CVSSv3_BaseScore","CVSSv3","CPE Confidence","Evidence Count"
solution-aop,"Fri, 11 Aug 2023 15:47:27 +0100",snakeyaml-1.33.jar,C:\Users\efeeeog\.m2\repository\org\yaml\snakeyaml\1.33\snakeyaml-1.33.jar,YAML 1.1 parser and emitter for Java,"Apache License, Version 2.0: http://www.apache.org/licenses/LICENSE-2.0.txt",e0164a637c691c8cf01d29f90a709c02,2cd0a87ff7df953f810c344bdf2fe3340b954c69,pkg:maven/org.yaml/snakeyaml@1.33,"cpe:2.3:a:snakeyaml_project:snakeyaml:1.33:*:*:*:*:*:*:*, cpe:2.3:a:yaml_project:yaml:1.33:*:*:*:*:*:*:*",CVE-2021-4235,NVD-CWE-noinfo,"Due to unbounded alias chasing, a maliciously crafted YAML file can cause the system to consume significant system resources. If parsing user input, this may be used as a denial of service vector.",NVD,"","","",MEDIUM,5.5,CVSS:3.1/AV:L/AC:L/PR:N/UI:R/S:U/C:N/I:N/A:H,HIGH,29
solution-aop,"Fri, 11 Aug 2023 15:47:27 +0100",snakeyaml-1.33.jar,C:\Users\efeeeog\.m2\repository\org\yaml\snakeyaml\1.33\snakeyaml-1.33.jar,YAML 1.1 parser and emitter for Java,"Apache License, Version 2.0: http://www.apache.org/licenses/LICENSE-2.0.txt",e0164a637c691c8cf01d29f90a709c02,2cd0a87ff7df953f810c344bdf2fe3340b954c69,pkg:maven/org.yaml/snakeyaml@1.33,"cpe:2.3:a:snakeyaml_project:snakeyaml:1.33:*:*:*:*:*:*:*, cpe:2.3:a:yaml_project:yaml:1.33:*:*:*:*:*:*:*",CVE-2022-1471,CWE-502 Deserialization of Untrusted Data,SnakeYaml's Constructor() class does not restrict types which can be instantiated during deserialization. Deserializing yaml content provided by an attacker can lead to remote code execution. We recommend using SnakeYaml's SafeConsturctor when parsing untrusted content to restrict deserialization. We recommend upgrading to version 2.0 and beyond.,NVD,"","","",CRITICAL,9.8,CVSS:3.1/AV:N/AC:L/PR:N/UI:N/S:U/C:H/I:H/A:H,HIGH,29
solution-aop,"Fri, 11 Aug 2023 15:47:27 +0100",snakeyaml-1.33.jar,C:\Users\efeeeog\.m2\repository\org\yaml\snakeyaml\1.33\snakeyaml-1.33.jar,YAML 1.1 parser and emitter for Java,"Apache License, Version 2.0: http://www.apache.org/licenses/LICENSE-2.0.txt",e0164a637c691c8cf01d29f90a709c02,2cd0a87ff7df953f810c344bdf2fe3340b954c69,pkg:maven/org.yaml/snakeyaml@1.33,"cpe:2.3:a:snakeyaml_project:snakeyaml:1.33:*:*:*:*:*:*:*, cpe:2.3:a:yaml_project:yaml:1.33:*:*:*:*:*:*:*",CVE-2022-3064,CWE-400 Uncontrolled Resource Consumption ('Resource Exhaustion'),Parsing malicious or large YAML documents can consume excessive amounts of CPU or memory.,NVD,"","","",HIGH,7.5,CVSS:3.1/AV:N/AC:L/PR:N/UI:N/S:U/C:N/I:N/A:H,HIGH,29
solution-aop,"Fri, 11 Aug 2023 15:47:27 +0100",snakeyaml-1.33.jar,C:\Users\efeeeog\.m2\repository\org\yaml\snakeyaml\1.33\snakeyaml-1.33.jar,YAML 1.1 parser and emitter for Java,"Apache License, Version 2.0: http://www.apache.org/licenses/LICENSE-2.0.txt",e0164a637c691c8cf01d29f90a709c02,2cd0a87ff7df953f810c344bdf2fe3340b954c69,pkg:maven/org.yaml/snakeyaml@1.33,"cpe:2.3:a:snakeyaml_project:snakeyaml:1.33:*:*:*:*:*:*:*, cpe:2.3:a:yaml_project:yaml:1.33:*:*:*:*:*:*:*",CVE-2023-2251,CWE-248 Uncaught Exception,Uncaught Exception in GitHub repository eemeli/yaml prior to 2.0.0-5.,NVD,"","","",HIGH,7.5,CVSS:3.1/AV:N/AC:L/PR:N/UI:N/S:U/C:N/I:N/A:H,HIGH,29
solution-aop,"Fri, 11 Aug 2023 15:47:27 +0100",spring-boot-3.0.2.jar,C:\Users\efeeeog\.m2\repository\org\springframework\boot\spring-boot\3.0.2\spring-boot-3.0.2.jar,Spring Boot,"Apache License, Version 2.0: https://www.apache.org/licenses/LICENSE-2.0",e33dc08955d4f64814facb3bde003f4a,69d2e0a07f7df180a4aacdc47c47a3db656857dc,pkg:maven/org.springframework.boot/spring-boot@3.0.2,cpe:2.3:a:vmware:spring_boot:3.0.2:*:*:*:*:*:*:*,CVE-2023-20873,NVD-CWE-noinfo,"In Spring Boot versions 3.0.0 - 3.0.5, 2.7.0 - 2.7.10, and older unsupported versions, an application that is deployed to Cloud Foundry could be susceptible to a security bypass. Users of affected versions should apply the following mitigation: 3.0.x users should upgrade to 3.0.6+. 2.7.x users should upgrade to 2.7.11+. Users of older, unsupported versions should upgrade to 3.0.6+ or 2.7.11+.",NVD,"","","",CRITICAL,9.8,CVSS:3.1/AV:N/AC:L/PR:N/UI:N/S:U/C:H/I:H/A:H,HIGH,29
solution-aop,"Fri, 11 Aug 2023 15:47:27 +0100",spring-boot-3.0.2.jar,C:\Users\efeeeog\.m2\repository\org\springframework\boot\spring-boot\3.0.2\spring-boot-3.0.2.jar,Spring Boot,"Apache License, Version 2.0: https://www.apache.org/licenses/LICENSE-2.0",e33dc08955d4f64814facb3bde003f4a,69d2e0a07f7df180a4aacdc47c47a3db656857dc,pkg:maven/org.springframework.boot/spring-boot@3.0.2,cpe:2.3:a:vmware:spring_boot:3.0.2:*:*:*:*:*:*:*,CVE-2023-20883,CWE-400 Uncontrolled Resource Consumption ('Resource Exhaustion'),"In Spring Boot versions 3.0.0 - 3.0.6, 2.7.0 - 2.7.11, 2.6.0 - 2.6.14, 2.5.0 - 2.5.14 and older unsupported versions, there is potential for a denial-of-service (DoS) attack if Spring MVC is used together with a reverse proxy cache.",NVD,"","","",HIGH,7.5,CVSS:3.1/AV:N/AC:L/PR:N/UI:N/S:U/C:N/I:N/A:H,HIGH,29
solution-aop,"Fri, 11 Aug 2023 15:47:27 +0100",spring-core-6.0.4.jar,C:\Users\efeeeog\.m2\repository\org\springframework\spring-core\6.0.4\spring-core-6.0.4.jar,Spring Core,"Apache License, Version 2.0: https://www.apache.org/licenses/LICENSE-2.0",a54a62940239e9147f5504ee84c9dcb2,8e24ad493887023cf5fac93541c72516f8ed9f6a,pkg:maven/org.springframework/spring-core@6.0.4,"cpe:2.3:a:pivotal_software:spring_framework:6.0.4:*:*:*:*:*:*:*, cpe:2.3:a:springsource:spring_framework:6.0.4:*:*:*:*:*:*:*, cpe:2.3:a:vmware:spring_framework:6.0.4:*:*:*:*:*:*:*",CVE-2023-20860,NVD-CWE-noinfo,"Spring Framework running version 6.0.0 - 6.0.6 or 5.3.0 - 5.3.25 using ""**"" as a pattern in Spring Security configuration with the mvcRequestMatcher creates a mismatch in pattern matching between Spring Security and Spring MVC, and the potential for a security bypass.",NVD,"","","",HIGH,7.5,CVSS:3.1/AV:N/AC:L/PR:N/UI:N/S:U/C:N/I:H/A:N,HIGH,30
solution-aop,"Fri, 11 Aug 2023 15:47:27 +0100",spring-core-6.0.4.jar,C:\Users\efeeeog\.m2\repository\org\springframework\spring-core\6.0.4\spring-core-6.0.4.jar,Spring Core,"Apache License, Version 2.0: https://www.apache.org/licenses/LICENSE-2.0",a54a62940239e9147f5504ee84c9dcb2,8e24ad493887023cf5fac93541c72516f8ed9f6a,pkg:maven/org.springframework/spring-core@6.0.4,"cpe:2.3:a:pivotal_software:spring_framework:6.0.4:*:*:*:*:*:*:*, cpe:2.3:a:springsource:spring_framework:6.0.4:*:*:*:*:*:*:*, cpe:2.3:a:vmware:spring_framework:6.0.4:*:*:*:*:*:*:*",CVE-2023-20861,NVD-CWE-noinfo,"In Spring Framework versions 6.0.0 - 6.0.6, 5.3.0 - 5.3.25, 5.2.0.RELEASE - 5.2.22.RELEASE, and older unsupported versions, it is possible for a user to provide a specially crafted SpEL expression that may cause a denial-of-service (DoS) condition.",NVD,"","","",MEDIUM,6.5,CVSS:3.1/AV:N/AC:L/PR:L/UI:N/S:U/C:N/I:N/A:H,HIGH,30
solution-aop,"Fri, 11 Aug 2023 15:47:27 +0100",spring-core-6.0.4.jar,C:\Users\efeeeog\.m2\repository\org\springframework\spring-core\6.0.4\spring-core-6.0.4.jar,Spring Core,"Apache License, Version 2.0: https://www.apache.org/licenses/LICENSE-2.0",a54a62940239e9147f5504ee84c9dcb2,8e24ad493887023cf5fac93541c72516f8ed9f6a,pkg:maven/org.springframework/spring-core@6.0.4,"cpe:2.3:a:pivotal_software:spring_framework:6.0.4:*:*:*:*:*:*:*, cpe:2.3:a:springsource:spring_framework:6.0.4:*:*:*:*:*:*:*, cpe:2.3:a:vmware:spring_framework:6.0.4:*:*:*:*:*:*:*",CVE-2023-20863,CWE-917 Improper Neutralization of Special Elements used in an Expression Language Statement ('Expression Language Injection'),"In spring framework versions prior to 5.2.24 release+ ,5.3.27+ and 6.0.8+ , it is possible for a user to provide a specially crafted SpEL expression that may cause a denial-of-service (DoS) condition.",NVD,"","","",MEDIUM,6.5,CVSS:3.1/AV:N/AC:L/PR:L/UI:N/S:U/C:N/I:N/A:H,HIGH,30
